score,category,title,company,salary_min_usd_month,salary_max_usd_month,salary_known,location_raw,source,date_posted,url,reasons,risks,status
74,good,"Solutions Consultant, Post Sales, Enterprise",Ramp,,,False,Remote (US),ashby,2026-07-09,https://jobs.ashbyhq.com/ramp/971abc99-f20b-43f0-91d6-90bcbfa2c8d9,"title matches target role (solutions consultant); strong profile similarity; remote; seniority fit (consultant); keywords: workflow, api, integration, rag",salary unknown,new
73,good,"Agentic AI Engineer (Boston, Hybrid) at Fairmarkit",,28000.0,31250.0,True,,jobscollider,2026-07-10,https://remotefirstjobs.com/companies/fairmarkit/jobs/agentic-ai-engineer-boston-hybrid-834912,"title matches target role (ai engineer); strong profile similarity; salary $28000+/mo; remote; keywords: automation, llm, api",,new
72,good,CRM Manager (ManyChat),Ruby Labs,,,False,European Union,ashby,2026-06-26,https://jobs.ashbyhq.com/ruby-labs/efca0423-e961-4846-8bac-3c5ab303d1cd,"title matches target role (crm); strong profile similarity; remote; keywords: automation, zapier, crm, api, webhook, integration",salary unknown,new
69,good,"Specialist, Business Process & Risk Control (SOX)",Agoda,,,False,"Bangkok, Thailand",greenhouse,2026-06-09,https://job-boards.greenhouse.io/agoda/jobs/7756959,"title matches target role (business process); remote; seniority fit (specialist); keywords: business process, rag",salary unknown,new
66,good,Salesforce Integration Engineer at Avive Solutions,,12500.0,15833.33,True,,jobscollider,2026-07-09,https://remotefirstjobs.com/companies/avive-solutions-inc/jobs/salesforce-integration-engineer-834858,"title matches target role (integration); salary $12500+/mo; remote; keywords: api, integration",,new
66,good,Legal Operations Specialist (Priceline PS/ B2B Division),Agoda,,,False,"Winnipeg, MB, Canada",greenhouse,2026-07-06,https://job-boards.greenhouse.io/agoda/jobs/8043016,"title matches target role (operations specialist); remote; seniority fit (specialist); keywords: prompt, workflow, rag",salary unknown,new
