score,category,title,company,salary_min_usd_month,salary_max_usd_month,salary_known,location_raw,source,date_posted,url,reasons,risks,status
91,apply_first,AI Automation Specialist at Pavago,,,,False,,jobscollider,2026-07-11,https://remotefirstjobs.com/companies/pavago/jobs/ai-automation-specialist-835456,"title matches target role (ai automation); strong profile similarity; remote; seniority fit (specialist); keywords: ai automation, automation, zapier, n8n, openai, chatgpt",salary unknown,new
83,apply_first,Web Developer & AI Specialist,Remote VA,,,False,Central Luzon,wwr,2026-06-18,https://weworkremotely.com/remote-jobs/remote-va-web-developer-ai-specialist,"title matches target role (ai specialist); strong profile similarity; remote; seniority fit (specialist); keywords: automation, claude, workflow, integration",salary unknown,new
81,apply_first,Incident Operations Specialist,Zapier,,,False,NAMER,ashby,2026-07-10,https://jobs.ashbyhq.com/zapier/375dd701-86ba-45cd-8c24-daff6cc49223,"title matches target role (operations specialist); strong profile similarity; remote; seniority fit (specialist); keywords: automation, zapier, chatgpt, claude, gemini, prompt",salary unknown,new
80,apply_first,Implementation Specialist - CRM at Nextech Systems,,,,False,,jobscollider,2026-07-11,https://remotefirstjobs.com/companies/nextech-systems/jobs/implementation-specialist-crm-835500,"title matches target role (implementation specialist); strong profile similarity; remote; seniority fit (specialist); keywords: workflow, crm, rag",salary unknown,new
74,good,GTM AI Engineer,higgsfieldai,,,False,"Almaty, Kazakhstan",ashby,2026-06-15,https://jobs.ashbyhq.com/higgsfieldai/cbc43adc-5c90-4018-bdc2-f846a7f0543e,"title matches target role (ai engineer); strong profile similarity; remote; keywords: automation, zapier, n8n, openai, chatgpt, claude",salary unknown,new
70,good,Customer Operations Specialist at Pavago,,,,False,,jobscollider,2026-07-11,https://remotefirstjobs.com/companies/pavago/jobs/customer-operations-specialist-835452,"title matches target role (operations specialist); remote; seniority fit (specialist); keywords: llm, workflow, crm, rag",salary unknown,new
67,good,Full-Stack AI Engineer at Pavago,,,,False,,jobscollider,2026-07-11,https://remotefirstjobs.com/companies/pavago/jobs/fullstack-ai-engineer-835466,"title matches target role (ai engineer); strong profile similarity; remote; keywords: ai automation, automation, openai, llm, prompt, workflow",salary unknown; negative keyword: kubernetes,new
